{
  "id": "member-0001",
  "name": "이상주",
  "photo_url": null,
  "district": "나 선거구(압해읍, 자은면, 암태면)",
  "party": "더불어민주당",
  "role": "의장",
  "phone": "010-3631-9440",
  "term": "제10대",
  "committees": [],
  "links": [],
  "_meta": {
    "source_url": "https://council.shinan.go.kr",
    "source_system": "MANUAL",
    "snapshot_path": null,
    "source_alive": true,
    "collected_at": "2026-07-11",
    "reviewed_by": "장경수",
    "reviewed_at": "2026-07-11"
  }
}
