{
  "id": "member-0009",
  "name": "최성자",
  "photo_url": null,
  "district": "비례대표",
  "party": "더불어민주당",
  "role": null,
  "phone": "010-4756-0575",
  "term": "제10대",
  "committees": [],
  "links": [],
  "_meta": {
    "source_url": "https://council.shinan.go.kr",
    "source_system": "MANUAL",
    "snapshot_path": null,
    "source_alive": true,
    "collected_at": "2026-07-11",
    "reviewed_by": "장경수",
    "reviewed_at": "2026-07-11"
  }
}
