{
  "id": "member-0008",
  "name": "김학기",
  "photo_url": null,
  "district": "다 선거구(비금면, 도초면, 흑산면)",
  "party": "더불어민주당",
  "role": null,
  "phone": "010-4631-6666",
  "term": "제10대",
  "committees": [],
  "links": [],
  "_meta": {
    "source_url": "https://council.shinan.go.kr",
    "source_system": "MANUAL",
    "snapshot_path": null,
    "source_alive": true,
    "collected_at": "2026-07-11",
    "reviewed_by": "장경수",
    "reviewed_at": "2026-07-11"
  }
}
