{
  "id": "member-9002",
  "name": "김철수(샘플)",
  "photo_url": null,
  "district": "샘플 선거구 나",
  "party": "무소속",
  "term": "제10대",
  "committees": ["산업건설위원회"],
  "links": [],
  "_meta": {
    "source_url": "https://council.shinan.go.kr/sample/member/9002",
    "source_system": "MANUAL",
    "collected_at": "2026-07-03",
    "reviewed_by": "SAMPLE-검수전",
    "reviewed_at": null
  }
}
